{
  "artifact": "run_brief",
  "schema_version": 1,
  "run_id": "20260607T130000Z-do",
  "command": "/z-do",
  "slug": "adhoc",
  "profile": "lite",
  "status": "halted",
  "generated_at": "2026-06-07T13:05:00Z",
  "intent": "Fix typo in README heading",
  "outcome": "Halted: scope exceeded threshold; routed to /z-plan",
  "next": {
    "label": "Run /z-plan",
    "command": "/z-plan"
  },
  "sources": {
    "intent": "do_run_start",
    "outcome": "run-status"
  }
}
